#-----------------------------------------------------------
# Vivado v2021.2 (64-bit)
# SW Build 3367213 on Tue Oct 19 02:47:39 MDT 2021
# IP Build 3369179 on Thu Oct 21 08:25:16 MDT 2021
# Start of session at: Fri Feb 20 16:25:20 2026
# Process ID: 4078543
# Current directory: /u/halle/dwe/home_at/Desktop/Test
# Command line: vivado Test.xpr
# Log file: /u/halle/dwe/home_at/Desktop/Test/vivado.log
# Journal file: /u/halle/dwe/home_at/Desktop/Test/vivado.jou
# Running On: halle.cli.ito.cit.tum.de, OS: Linux, CPU Frequency: 3749.977 MHz, CPU Physical cores: 32, Host memory: 810729 MB
#-----------------------------------------------------------
start_gui
open_project Test.xpr
WARNING: [Board 49-26] cannot add Board Part xilinx.com:kc705:part0:1.6 available at /var/tmp/dwe_vivado_inst/Vivado/2021.2/data/xhub/boards/XilinxBoardStore/boards/Xilinx/kc705/1.6/board.xml as part xc7k325tffg900-2 specified in board_part file is either invalid or not available
WARNING: [Board 49-26] cannot add Board Part xilinx.com:kcu105:part0:1.6 available at /var/tmp/dwe_vivado_inst/Vivado/2021.2/data/xhub/boards/XilinxBoardStore/boards/Xilinx/kcu105/1.6/board.xml as part xcku040-ffva1156-2-e specified in board_part file is either invalid or not available
WARNING: [Board 49-26] cannot add Board Part xilinx.com:kcu105:part0:1.7 available at /var/tmp/dwe_vivado_inst/Vivado/2021.2/data/xhub/boards/XilinxBoardStore/boards/Xilinx/kcu105/1.7/board.xml as part xcku040-ffva1156-2-e specified in board_part file is either invalid or not available
WARNING: [Board 49-26] cannot add Board Part xilinx.com:kcu116:part0:1.4 available at /var/tmp/dwe_vivado_inst/Vivado/2021.2/data/xhub/boards/XilinxBoardStore/boards/Xilinx/kcu116/1.4/board.xml as part xcku5p-ffvb676-2-e specified in board_part file is either invalid or not available
WARNING: [Board 49-26] cannot add Board Part xilinx.com:kcu116:part0:1.5 available at /var/tmp/dwe_vivado_inst/Vivado/2021.2/data/xhub/boards/XilinxBoardStore/boards/Xilinx/kcu116/1.5/board.xml as part xcku5p-ffvb676-2-e specified in board_part file is either invalid or not available
WARNING: [Board 49-26] cannot add Board Part xilinx.com:kcu1500:part0:1.2 available at /var/tmp/dwe_vivado_inst/Vivado/2021.2/data/xhub/boards/XilinxBoardStore/boards/Xilinx/kcu1500/1.2/board.xml as part xcku115-flvb2104-2-e specified in board_part file is either invalid or not available
WARNING: [Board 49-26] cannot add Board Part xilinx.com:vc707:part0:1.4 available at /var/tmp/dwe_vivado_inst/Vivado/2021.2/data/xhub/boards/XilinxBoardStore/boards/Xilinx/vc707/1.4/board.xml as part xc7vx485tffg1761-2 specified in board_part file is either invalid or not available
WARNING: [Board 49-26] cannot add Board Part xilinx.com:vc709:part0:1.8 available at /var/tmp/dwe_vivado_inst/Vivado/2021.2/data/xhub/boards/XilinxBoardStore/boards/Xilinx/vc709/1.8/board.xml as part xc7vx690tffg1761-2 specified in board_part file is either invalid or not available
WARNING: [Board 49-26] cannot add Board Part xilinx.com:vck190:part0:2.2 available at /var/tmp/dwe_vivado_inst/Vivado/2021.2/data/xhub/boards/XilinxBoardStore/boards/Xilinx/vck190/production/2.2/board.xml as part xcvc1902-vsva2197-2mp-e-s specified in board_part file is either invalid or not available
WARNING: [Board 49-26] cannot add Board Part xilinx.com:vck190_es:part0:1.3 available at /var/tmp/dwe_vivado_inst/Vivado/2021.2/data/xhub/boards/XilinxBoardStore/boards/Xilinx/vck190/es/1.3/board.xml as part xcvc1902-vsva2197-2mp-e-s-es1 specified in board_part file is either invalid or not available
WARNING: [Board 49-26] cannot add Board Part xilinx.com:vcu108:part0:1.6 available at /var/tmp/dwe_vivado_inst/Vivado/2021.2/data/xhub/boards/XilinxBoardStore/boards/Xilinx/vcu108/1.6/board.xml as part xcvu095-ffva2104-2-e specified in board_part file is either invalid or not available
WARNING: [Board 49-26] cannot add Board Part xilinx.com:vcu108:part0:1.7 available at /var/tmp/dwe_vivado_inst/Vivado/2021.2/data/xhub/boards/XilinxBoardStore/boards/Xilinx/vcu108/1.7/board.xml as part xcvu095-ffva2104-2-e specified in board_part file is either invalid or not available
WARNING: [Board 49-26] cannot add Board Part xilinx.com:vcu110:part0:1.4 available at /var/tmp/dwe_vivado_inst/Vivado/2021.2/data/xhub/boards/XilinxBoardStore/boards/Xilinx/vcu110/1.4/board.xml as part xcvu190-flgc2104-2-e specified in board_part file is either invalid or not available
WARNING: [Board 49-26] cannot add Board Part xilinx.com:vcu118:part0:2.0 available at /var/tmp/dwe_vivado_inst/Vivado/2021.2/data/xhub/boards/XilinxBoardStore/boards/Xilinx/vcu118/2.0/board.xml as part xcvu9p-flga2104-2l-e specified in board_part file is either invalid or not available
WARNING: [Board 49-26] cannot add Board Part xilinx.com:vcu118:part0:2.3 available at /var/tmp/dwe_vivado_inst/Vivado/2021.2/data/xhub/boards/XilinxBoardStore/boards/Xilinx/vcu118/2.3/board.xml as part xcvu9p-flga2104-2l-e specified in board_part file is either invalid or not available
WARNING: [Board 49-26] cannot add Board Part xilinx.com:vcu118:part0:2.4 available at /var/tmp/dwe_vivado_inst/Vivado/2021.2/data/xhub/boards/XilinxBoardStore/boards/Xilinx/vcu118/2.4/board.xml as part xcvu9p-flga2104-2l-e specified in board_part file is either invalid or not available
WARNING: [Board 49-26] cannot add Board Part xilinx.com:vcu128:part0:1.0 available at /var/tmp/dwe_vivado_inst/Vivado/2021.2/data/xhub/boards/XilinxBoardStore/boards/Xilinx/vcu128/production/1.0/board.xml as part xcvu37p-fsvh2892-2l-e specified in board_part file is either invalid or not available
WARNING: [Board 49-26] cannot add Board Part xilinx.com:vcu129:part0:1.0 available at /var/tmp/dwe_vivado_inst/Vivado/2021.2/data/xhub/boards/XilinxBoardStore/boards/Xilinx/vcu129/production/1.0/board.xml as part xcvu29p-fsga2577-2l-e specified in board_part file is either invalid or not available
WARNING: [Board 49-26] cannot add Board Part xilinx.com:vcu1525:part0:1.3 available at /var/tmp/dwe_vivado_inst/Vivado/2021.2/data/xhub/boards/XilinxBoardStore/boards/Xilinx/vcu1525/1.3/board.xml as part xcvu9p-fsgd2104-2l-e specified in board_part file is either invalid or not available
WARNING: [Board 49-26] cannot add Board Part xilinx.com:vermeo_t1_mpsoc:part0:1.0 available at /var/tmp/dwe_vivado_inst/Vivado/2021.2/data/xhub/boards/XilinxBoardStore/boards/Xilinx/vermeo_t1_mpsoc/1.0/board.xml as part xczu19eg-ffvd1760-2l-e specified in board_part file is either invalid or not available
WARNING: [Board 49-26] cannot add Board Part xilinx.com:vermeo_t1_rfsoc:part0:1.0 available at /var/tmp/dwe_vivado_inst/Vivado/2021.2/data/xhub/boards/XilinxBoardStore/boards/Xilinx/vermeo_t1_rfsoc/1.0/board.xml as part xczu21dr-ffvd1156-2l-e specified in board_part file is either invalid or not available
WARNING: [Board 49-26] cannot add Board Part xilinx.com:vmk180:part0:2.2 available at /var/tmp/dwe_vivado_inst/Vivado/2021.2/data/xhub/boards/XilinxBoardStore/boards/Xilinx/vmk180/production/2.2/board.xml as part xcvm1802-vsva2197-2mp-e-s specified in board_part file is either invalid or not available
WARNING: [Board 49-26] cannot add Board Part xilinx.com:vmk180_es:part0:1.3 available at /var/tmp/dwe_vivado_inst/Vivado/2021.2/data/xhub/boards/XilinxBoardStore/boards/Xilinx/vmk180/es/1.3/board.xml as part xcvm1802-vsva2197-2mp-e-s-es1 specified in board_part file is either invalid or not available
WARNING: [Board 49-26] cannot add Board Part xilinx.com:vpk120_es:part0:1.2 available at /var/tmp/dwe_vivado_inst/Vivado/2021.2/data/xhub/boards/XilinxBoardStore/boards/Xilinx/vpk120/es/1.2/board.xml as part xcvp1202-vsva2785-2mp-e-s-es1 specified in board_part file is either invalid or not available
WARNING: [Board 49-26] cannot add Board Part xilinx.com:zc706:part0:1.4 available at /var/tmp/dwe_vivado_inst/Vivado/2021.2/data/xhub/boards/XilinxBoardStore/boards/Xilinx/zc706/1.4/board.xml as part xc7z045ffg900-2 specified in board_part file is either invalid or not available
WARNING: [Board 49-26] cannot add Board Part xilinx.com:zcu102:part0:3.3 available at /var/tmp/dwe_vivado_inst/Vivado/2021.2/data/xhub/boards/XilinxBoardStore/boards/Xilinx/zcu102/3.3/board.xml as part xczu9eg-ffvb1156-2-e specified in board_part file is either invalid or not available
WARNING: [Board 49-26] cannot add Board Part xilinx.com:zcu102:part0:3.4 available at /var/tmp/dwe_vivado_inst/Vivado/2021.2/data/xhub/boards/XilinxBoardStore/boards/Xilinx/zcu102/3.4/board.xml as part xczu9eg-ffvb1156-2-e specified in board_part file is either invalid or not available
WARNING: [Board 49-26] cannot add Board Part xilinx.com:zcu111:part0:1.2 available at /var/tmp/dwe_vivado_inst/Vivado/2021.2/data/xhub/boards/XilinxBoardStore/boards/Xilinx/zcu111/1.2/board.xml as part xczu28dr-ffvg1517-2-e specified in board_part file is either invalid or not available
WARNING: [Board 49-26] cannot add Board Part xilinx.com:zcu111:part0:1.3 available at /var/tmp/dwe_vivado_inst/Vivado/2021.2/data/xhub/boards/XilinxBoardStore/boards/Xilinx/zcu111/1.3/board.xml as part xczu28dr-ffvg1517-2-e specified in board_part file is either invalid or not available
WARNING: [Board 49-26] cannot add Board Part xilinx.com:zcu111:part0:1.4 available at /var/tmp/dwe_vivado_inst/Vivado/2021.2/data/xhub/boards/XilinxBoardStore/boards/Xilinx/zcu111/1.4/board.xml as part xczu28dr-ffvg1517-2-e specified in board_part file is either invalid or not available
WARNING: [Board 49-26] cannot add Board Part xilinx.com:zcu1275:part0:1.0 available at /var/tmp/dwe_vivado_inst/Vivado/2021.2/data/xhub/boards/XilinxBoardStore/boards/Xilinx/zcu1275/1.0/board.xml as part xczu29dr-ffvf1760-2-e specified in board_part file is either invalid or not available
WARNING: [Board 49-26] cannot add Board Part xilinx.com:zcu1285:part0:1.0 available at /var/tmp/dwe_vivado_inst/Vivado/2021.2/data/xhub/boards/XilinxBoardStore/boards/Xilinx/zcu1285/1.0/board.xml as part xczu39dr-ffvf1760-2-i specified in board_part file is either invalid or not available
WARNING: [Board 49-26] cannot add Board Part xilinx.com:zcu208:part0:2.0 available at /var/tmp/dwe_vivado_inst/Vivado/2021.2/data/xhub/boards/XilinxBoardStore/boards/Xilinx/zcu208/production/2.0/board.xml as part xczu48dr-fsvg1517-2-e specified in board_part file is either invalid or not available
WARNING: [Board 49-26] cannot add Board Part xilinx.com:zcu208_es:part0:1.0 available at /var/tmp/dwe_vivado_inst/Vivado/2021.2/data/xhub/boards/XilinxBoardStore/boards/Xilinx/zcu208/es/1.0/board.xml as part xczu48dr-fsvg1517-2-e-es1 specified in board_part file is either invalid or not available
WARNING: [Board 49-26] cannot add Board Part xilinx.com:zcu208_es:part0:1.1 available at /var/tmp/dwe_vivado_inst/Vivado/2021.2/data/xhub/boards/XilinxBoardStore/boards/Xilinx/zcu208/es/1.1/board.xml as part xczu48dr-fsvg1517-2-e-es1 specified in board_part file is either invalid or not available
WARNING: [Board 49-26] cannot add Board Part xilinx.com:zcu208_es:part0:1.2 available at /var/tmp/dwe_vivado_inst/Vivado/2021.2/data/xhub/boards/XilinxBoardStore/boards/Xilinx/zcu208/es/1.2/board.xml as part xczu48dr-fsvg1517-2-e-es1 specified in board_part file is either invalid or not available
WARNING: [Board 49-26] cannot add Board Part xilinx.com:zcu208ld:part0:2.0 available at /var/tmp/dwe_vivado_inst/Vivado/2021.2/data/xhub/boards/XilinxBoardStore/boards/Xilinx/zcu208ld/production/2.0/board.xml as part xczu58dr-fsvg1517-2-i specified in board_part file is either invalid or not available
WARNING: [Board 49-26] cannot add Board Part xilinx.com:zcu208ld_es:part0:1.0 available at /var/tmp/dwe_vivado_inst/Vivado/2021.2/data/xhub/boards/XilinxBoardStore/boards/Xilinx/zcu208ld/es/1.0/board.xml as part xczu58dr-fsvg1517-2-i-es1 specified in board_part file is either invalid or not available
WARNING: [Board 49-26] cannot add Board Part xilinx.com:zcu216:part0:2.0 available at /var/tmp/dwe_vivado_inst/Vivado/2021.2/data/xhub/boards/XilinxBoardStore/boards/Xilinx/zcu216/production/2.0/board.xml as part xczu49dr-ffvf1760-2-e specified in board_part file is either invalid or not available
WARNING: [Board 49-26] cannot add Board Part xilinx.com:zcu216_es:part0:1.0 available at /var/tmp/dwe_vivado_inst/Vivado/2021.2/data/xhub/boards/XilinxBoardStore/boards/Xilinx/zcu216/es/1.0/board.xml as part xczu49dr-ffvf1760-2-e-es1 specified in board_part file is either invalid or not available
WARNING: [Board 49-26] cannot add Board Part xilinx.com:zcu216_es:part0:1.1 available at /var/tmp/dwe_vivado_inst/Vivado/2021.2/data/xhub/boards/XilinxBoardStore/boards/Xilinx/zcu216/es/1.1/board.xml as part xczu49dr-ffvf1760-2-e-es1 specified in board_part file is either invalid or not available
WARNING: [Board 49-26] cannot add Board Part xilinx.com:zcu216_es:part0:1.2 available at /var/tmp/dwe_vivado_inst/Vivado/2021.2/data/xhub/boards/XilinxBoardStore/boards/Xilinx/zcu216/es/1.2/board.xml as part xczu49dr-ffvf1760-2-e-es1 specified in board_part file is either invalid or not available
WARNING: [Board 49-26] cannot add Board Part xilinx.com:zcu216ld:part0:2.0 available at /var/tmp/dwe_vivado_inst/Vivado/2021.2/data/xhub/boards/XilinxBoardStore/boards/Xilinx/zcu216ld/production/2.0/board.xml as part xczu59dr-ffvf1760-2-i specified in board_part file is either invalid or not available
WARNING: [Board 49-26] cannot add Board Part xilinx.com:zcu216ld_es:part0:1.0 available at /var/tmp/dwe_vivado_inst/Vivado/2021.2/data/xhub/boards/XilinxBoardStore/boards/Xilinx/zcu216ld/es/1.0/board.xml as part xczu59dr-ffvf1760-2-i-es1 specified in board_part file is either invalid or not available
WARNING: [Board 49-26] cannot add Board Part xilinx.com:zcu670:part0:1.0 available at /var/tmp/dwe_vivado_inst/Vivado/2021.2/data/xhub/boards/XilinxBoardStore/boards/Xilinx/zcu670/1.0/board.xml as part xczu67dr-fsve1156-2-i specified in board_part file is either invalid or not available
Scanning sources...
Finished scanning sources
INFO: [IP_Flow 19-234] Refreshing IP repositories
INFO: [IP_Flow 19-1700] Loaded user IP repository '/u/halle/dwe/home_at/Desktop/Test/Test.srcs'.
WARNING: [IP_Flow 19-3685] Ignored loading user repository '/u/halle/dwe/home_at/Desktop/Test/Test.srcs/sources_1/imports/riscv-single'. The path is contained within another repository.
INFO: [IP_Flow 19-2313] Loaded Vivado IP repository '/var/tmp/dwe_vivado_inst/Vivado/2021.2/data/ip'.
WARNING: [IP_Flow 19-1663] Duplicate IP found for 'user.org:user:rv_pl:1.0'. The one found in IP location '/u/halle/dwe/home_at/Desktop/Test/Test.srcs' will take precedence over the same IP in location /u/halle/dwe/home_at/Desktop/Test/Test.srcs/sources_1/imports/riscv-single
open_project: Time (s): cpu = 00:00:16 ; elapsed = 00:00:07 . Memory (MB): peak = 7954.332 ; gain = 132.387 ; free physical = 382299 ; free virtual = 792031
update_compile_order -fileset sources_1
create_ip_run [get_files -of_objects [get_fileset sources_1] /u/halle/dwe/home_at/Desktop/Test/Test.srcs/sources_1/bd/design_1/design_1.bd]
synth_design -rtl -rtl_skip_mlo -name rtl_1
Command: synth_design -rtl -rtl_skip_mlo -name rtl_1
Starting synth_design
Using part: xc7z020clg400-1
Top: design_1_wrapper
INFO: [Device 21-403] Loading part xc7z020clg400-1
---------------------------------------------------------------------------------
Starting RTL Elaboration : Time (s): cpu = 00:00:02 ; elapsed = 00:00:02 . Memory (MB): peak = 8218.461 ; gain = 0.000 ; free physical = 379876 ; free virtual = 789640
---------------------------------------------------------------------------------
INFO: [Synth 8-6157] synthesizing module 'design_1_wrapper' [/u/halle/dwe/home_at/Desktop/Test/Test.gen/sources_1/bd/design_1/hdl/design_1_wrapper.v:12]
INFO: [Synth 8-6157] synthesizing module 'design_1' [/u/halle/dwe/home_at/Desktop/Test/Test.gen/sources_1/bd/design_1/synth/design_1.v:13]
INFO: [Synth 8-6157] synthesizing module 'design_1_axi_bram_ctrl_0_0' [/u/halle/dwe/home_at/Desktop/Test/.Xil/Vivado-4078543-halle.cli.ito.cit.tum.de/realtime/design_1_axi_bram_ctrl_0_0_stub.v:6]
INFO: [Synth 8-6155] done synthesizing module 'design_1_axi_bram_ctrl_0_0' (1#1) [/u/halle/dwe/home_at/Desktop/Test/.Xil/Vivado-4078543-halle.cli.ito.cit.tum.de/realtime/design_1_axi_bram_ctrl_0_0_stub.v:6]
INFO: [Synth 8-6157] synthesizing module 'design_1_axi_bram_ctrl_1_0' [/u/halle/dwe/home_at/Desktop/Test/.Xil/Vivado-4078543-halle.cli.ito.cit.tum.de/realtime/design_1_axi_bram_ctrl_1_0_stub.v:6]
INFO: [Synth 8-6155] done synthesizing module 'design_1_axi_bram_ctrl_1_0' (2#1) [/u/halle/dwe/home_at/Desktop/Test/.Xil/Vivado-4078543-halle.cli.ito.cit.tum.de/realtime/design_1_axi_bram_ctrl_1_0_stub.v:6]
INFO: [Synth 8-6157] synthesizing module 'design_1_axi_bram_ctrl_1_bram_0' [/u/halle/dwe/home_at/Desktop/Test/.Xil/Vivado-4078543-halle.cli.ito.cit.tum.de/realtime/design_1_axi_bram_ctrl_1_bram_0_stub.v:6]
INFO: [Synth 8-6155] done synthesizing module 'design_1_axi_bram_ctrl_1_bram_0' (3#1) [/u/halle/dwe/home_at/Desktop/Test/.Xil/Vivado-4078543-halle.cli.ito.cit.tum.de/realtime/design_1_axi_bram_ctrl_1_bram_0_stub.v:6]
WARNING: [Synth 8-7071] port 'rsta_busy' of module 'design_1_axi_bram_ctrl_1_bram_0' is unconnected for instance 'axi_bram_ctrl_1_bram' [/u/halle/dwe/home_at/Desktop/Test/Test.gen/sources_1/bd/design_1/synth/design_1.v:356]
WARNING: [Synth 8-7071] port 'rstb_busy' of module 'design_1_axi_bram_ctrl_1_bram_0' is unconnected for instance 'axi_bram_ctrl_1_bram' [/u/halle/dwe/home_at/Desktop/Test/Test.gen/sources_1/bd/design_1/synth/design_1.v:356]
WARNING: [Synth 8-7023] instance 'axi_bram_ctrl_1_bram' of module 'design_1_axi_bram_ctrl_1_bram_0' has 16 connections declared, but only 14 given [/u/halle/dwe/home_at/Desktop/Test/Test.gen/sources_1/bd/design_1/synth/design_1.v:356]
INFO: [Synth 8-6157] synthesizing module 'design_1_axi_gpio_0_1' [/u/halle/dwe/home_at/Desktop/Test/.Xil/Vivado-4078543-halle.cli.ito.cit.tum.de/realtime/design_1_axi_gpio_0_1_stub.v:6]
INFO: [Synth 8-6155] done synthesizing module 'design_1_axi_gpio_0_1' (4#1) [/u/halle/dwe/home_at/Desktop/Test/.Xil/Vivado-4078543-halle.cli.ito.cit.tum.de/realtime/design_1_axi_gpio_0_1_stub.v:6]
INFO: [Synth 8-6157] synthesizing module 'design_1_axi_smc_2' [/u/halle/dwe/home_at/Desktop/Test/.Xil/Vivado-4078543-halle.cli.ito.cit.tum.de/realtime/design_1_axi_smc_2_stub.v:6]
INFO: [Synth 8-6155] done synthesizing module 'design_1_axi_smc_2' (5#1) [/u/halle/dwe/home_at/Desktop/Test/.Xil/Vivado-4078543-halle.cli.ito.cit.tum.de/realtime/design_1_axi_smc_2_stub.v:6]
WARNING: [Synth 8-7071] port 'M00_AXI_awqos' of module 'design_1_axi_smc_2' is unconnected for instance 'axi_smc' [/u/halle/dwe/home_at/Desktop/Test/Test.gen/sources_1/bd/design_1/synth/design_1.v:392]
WARNING: [Synth 8-7071] port 'M00_AXI_arqos' of module 'design_1_axi_smc_2' is unconnected for instance 'axi_smc' [/u/halle/dwe/home_at/Desktop/Test/Test.gen/sources_1/bd/design_1/synth/design_1.v:392]
WARNING: [Synth 8-7071] port 'M01_AXI_awqos' of module 'design_1_axi_smc_2' is unconnected for instance 'axi_smc' [/u/halle/dwe/home_at/Desktop/Test/Test.gen/sources_1/bd/design_1/synth/design_1.v:392]
WARNING: [Synth 8-7071] port 'M01_AXI_arqos' of module 'design_1_axi_smc_2' is unconnected for instance 'axi_smc' [/u/halle/dwe/home_at/Desktop/Test/Test.gen/sources_1/bd/design_1/synth/design_1.v:392]
WARNING: [Synth 8-7071] port 'M02_AXI_awprot' of module 'design_1_axi_smc_2' is unconnected for instance 'axi_smc' [/u/halle/dwe/home_at/Desktop/Test/Test.gen/sources_1/bd/design_1/synth/design_1.v:392]
WARNING: [Synth 8-7071] port 'M02_AXI_arprot' of module 'design_1_axi_smc_2' is unconnected for instance 'axi_smc' [/u/halle/dwe/home_at/Desktop/Test/Test.gen/sources_1/bd/design_1/synth/design_1.v:392]
WARNING: [Synth 8-7023] instance 'axi_smc' of module 'design_1_axi_smc_2' has 152 connections declared, but only 146 given [/u/halle/dwe/home_at/Desktop/Test/Test.gen/sources_1/bd/design_1/synth/design_1.v:392]
INFO: [Synth 8-6157] synthesizing module 'design_1_blk_mem_gen_0_0' [/u/halle/dwe/home_at/Desktop/Test/.Xil/Vivado-4078543-halle.cli.ito.cit.tum.de/realtime/design_1_blk_mem_gen_0_0_stub.v:6]
INFO: [Synth 8-6155] done synthesizing module 'design_1_blk_mem_gen_0_0' (6#1) [/u/halle/dwe/home_at/Desktop/Test/.Xil/Vivado-4078543-halle.cli.ito.cit.tum.de/realtime/design_1_blk_mem_gen_0_0_stub.v:6]
WARNING: [Synth 8-7071] port 'rsta_busy' of module 'design_1_blk_mem_gen_0_0' is unconnected for instance 'blk_mem_gen_0' [/u/halle/dwe/home_at/Desktop/Test/Test.gen/sources_1/bd/design_1/synth/design_1.v:539]
WARNING: [Synth 8-7071] port 'rstb_busy' of module 'design_1_blk_mem_gen_0_0' is unconnected for instance 'blk_mem_gen_0' [/u/halle/dwe/home_at/Desktop/Test/Test.gen/sources_1/bd/design_1/synth/design_1.v:539]
WARNING: [Synth 8-7023] instance 'blk_mem_gen_0' of module 'design_1_blk_mem_gen_0_0' has 16 connections declared, but only 14 given [/u/halle/dwe/home_at/Desktop/Test/Test.gen/sources_1/bd/design_1/synth/design_1.v:539]
INFO: [Synth 8-6157] synthesizing module 'design_1_processing_system7_0_0' [/u/halle/dwe/home_at/Desktop/Test/.Xil/Vivado-4078543-halle.cli.ito.cit.tum.de/realtime/design_1_processing_system7_0_0_stub.v:6]
INFO: [Synth 8-6155] done synthesizing module 'design_1_processing_system7_0_0' (7#1) [/u/halle/dwe/home_at/Desktop/Test/.Xil/Vivado-4078543-halle.cli.ito.cit.tum.de/realtime/design_1_processing_system7_0_0_stub.v:6]
INFO: [Synth 8-6157] synthesizing module 'design_1_rst_ps7_0_50M_0' [/u/halle/dwe/home_at/Desktop/Test/.Xil/Vivado-4078543-halle.cli.ito.cit.tum.de/realtime/design_1_rst_ps7_0_50M_0_stub.v:6]
INFO: [Synth 8-6155] done synthesizing module 'design_1_rst_ps7_0_50M_0' (8#1) [/u/halle/dwe/home_at/Desktop/Test/.Xil/Vivado-4078543-halle.cli.ito.cit.tum.de/realtime/design_1_rst_ps7_0_50M_0_stub.v:6]
WARNING: [Synth 8-7071] port 'mb_reset' of module 'design_1_rst_ps7_0_50M_0' is unconnected for instance 'rst_ps7_0_50M' [/u/halle/dwe/home_at/Desktop/Test/Test.gen/sources_1/bd/design_1/synth/design_1.v:619]
WARNING: [Synth 8-7071] port 'bus_struct_reset' of module 'design_1_rst_ps7_0_50M_0' is unconnected for instance 'rst_ps7_0_50M' [/u/halle/dwe/home_at/Desktop/Test/Test.gen/sources_1/bd/design_1/synth/design_1.v:619]
WARNING: [Synth 8-7071] port 'peripheral_reset' of module 'design_1_rst_ps7_0_50M_0' is unconnected for instance 'rst_ps7_0_50M' [/u/halle/dwe/home_at/Desktop/Test/Test.gen/sources_1/bd/design_1/synth/design_1.v:619]
WARNING: [Synth 8-7023] instance 'rst_ps7_0_50M' of module 'design_1_rst_ps7_0_50M_0' has 10 connections declared, but only 7 given [/u/halle/dwe/home_at/Desktop/Test/Test.gen/sources_1/bd/design_1/synth/design_1.v:619]
INFO: [Synth 8-6157] synthesizing module 'design_1_rv_pl_0_1' [/u/halle/dwe/home_at/Desktop/Test/.Xil/Vivado-4078543-halle.cli.ito.cit.tum.de/realtime/design_1_rv_pl_0_1_stub.v:6]
INFO: [Synth 8-6155] done synthesizing module 'design_1_rv_pl_0_1' (9#1) [/u/halle/dwe/home_at/Desktop/Test/.Xil/Vivado-4078543-halle.cli.ito.cit.tum.de/realtime/design_1_rv_pl_0_1_stub.v:6]
INFO: [Synth 8-6155] done synthesizing module 'design_1' (10#1) [/u/halle/dwe/home_at/Desktop/Test/Test.gen/sources_1/bd/design_1/synth/design_1.v:13]
INFO: [Synth 8-6155] done synthesizing module 'design_1_wrapper' (11#1) [/u/halle/dwe/home_at/Desktop/Test/Test.gen/sources_1/bd/design_1/hdl/design_1_wrapper.v:12]
---------------------------------------------------------------------------------
Finished RTL Elaboration : Time (s): cpu = 00:00:03 ; elapsed = 00:00:03 . Memory (MB): peak = 8218.461 ; gain = 0.000 ; free physical = 380184 ; free virtual = 789950
---------------------------------------------------------------------------------
---------------------------------------------------------------------------------
Start Handling Custom Attributes
---------------------------------------------------------------------------------
---------------------------------------------------------------------------------
Finished Handling Custom Attributes : Time (s): cpu = 00:00:03 ; elapsed = 00:00:04 . Memory (MB): peak = 8218.461 ; gain = 0.000 ; free physical = 379738 ; free virtual = 789503
---------------------------------------------------------------------------------
---------------------------------------------------------------------------------
Finished RTL Optimization Phase 1 : Time (s): cpu = 00:00:03 ; elapsed = 00:00:04 . Memory (MB): peak = 8218.461 ; gain = 0.000 ; free physical = 379738 ; free virtual = 789503
---------------------------------------------------------------------------------
INFO: [Project 1-454] Reading design checkpoint '/u/halle/dwe/home_at/Desktop/Test/Test.gen/sources_1/bd/design_1/ip/design_1_axi_bram_ctrl_0_0/design_1_axi_bram_ctrl_0_0.dcp' for cell 'design_1_i/axi_bram_ctrl_0'
INFO: [Project 1-454] Reading design checkpoint '/u/halle/dwe/home_at/Desktop/Test/Test.gen/sources_1/bd/design_1/ip/design_1_axi_bram_ctrl_1_0/design_1_axi_bram_ctrl_1_0.dcp' for cell 'design_1_i/axi_bram_ctrl_1'
INFO: [Project 1-454] Reading design checkpoint '/u/halle/dwe/home_at/Desktop/Test/Test.gen/sources_1/bd/design_1/ip/design_1_axi_bram_ctrl_1_bram_0/design_1_axi_bram_ctrl_1_bram_0.dcp' for cell 'design_1_i/axi_bram_ctrl_1_bram'
INFO: [Project 1-454] Reading design checkpoint '/u/halle/dwe/home_at/Desktop/Test/Test.gen/sources_1/bd/design_1/ip/design_1_axi_gpio_0_1_1/design_1_axi_gpio_0_1.dcp' for cell 'design_1_i/axi_gpio_0'
INFO: [Project 1-454] Reading design checkpoint '/u/halle/dwe/home_at/Desktop/Test/Test.gen/sources_1/bd/design_1/ip/design_1_axi_smc_2/design_1_axi_smc_2.dcp' for cell 'design_1_i/axi_smc'
INFO: [Project 1-454] Reading design checkpoint '/u/halle/dwe/home_at/Desktop/Test/Test.gen/sources_1/bd/design_1/ip/design_1_blk_mem_gen_0_0_1/design_1_blk_mem_gen_0_0.dcp' for cell 'design_1_i/blk_mem_gen_0'
INFO: [Project 1-454] Reading design checkpoint '/u/halle/dwe/home_at/Desktop/Test/Test.gen/sources_1/bd/design_1/ip/design_1_processing_system7_0_0_1/design_1_processing_system7_0_0.dcp' for cell 'design_1_i/processing_system7_0'
INFO: [Project 1-454] Reading design checkpoint '/u/halle/dwe/home_at/Desktop/Test/Test.gen/sources_1/bd/design_1/ip/design_1_rst_ps7_0_50M_0_1/design_1_rst_ps7_0_50M_0.dcp' for cell 'design_1_i/rst_ps7_0_50M'
INFO: [Project 1-454] Reading design checkpoint '/u/halle/dwe/home_at/Desktop/Test/Test.gen/sources_1/bd/design_1/ip/design_1_rv_pl_0_1_1/design_1_rv_pl_0_1.dcp' for cell 'design_1_i/rv_pl_0'
Netlist sorting complete. Time (s): cpu = 00:00:00.29 ; elapsed = 00:00:00.28 . Memory (MB): peak = 8218.461 ; gain = 0.000 ; free physical = 380314 ; free virtual = 790079
INFO: [Netlist 29-17] Analyzing 437 Unisim elements for replacement
INFO: [Netlist 29-28] Unisim Transformation completed in 0 CPU seconds
INFO: [Project 1-479] Netlist was created with Vivado 2021.2
INFO: [Project 1-570] Preparing netlist for logic optimization

Processing XDC Constraints
Initializing timing engine
Parsing XDC File [/u/halle/dwe/home_at/Desktop/Test/Test.gen/sources_1/bd/design_1/ip/design_1_processing_system7_0_0_1/design_1_processing_system7_0_0.xdc] for cell 'design_1_i/processing_system7_0/inst'
Finished Parsing XDC File [/u/halle/dwe/home_at/Desktop/Test/Test.gen/sources_1/bd/design_1/ip/design_1_processing_system7_0_0_1/design_1_processing_system7_0_0.xdc] for cell 'design_1_i/processing_system7_0/inst'
INFO: [Project 1-236] Implementation specific constraints were found while reading constraint file [/u/halle/dwe/home_at/Desktop/Test/Test.gen/sources_1/bd/design_1/ip/design_1_processing_system7_0_0_1/design_1_processing_system7_0_0.xdc]. These constraints will be ignored for synthesis but will be used in implementation. Impacted constraints are listed in the file [.Xil/design_1_wrapper_propImpl.xdc].
Resolution: To avoid this warning, move constraints listed in [.Xil/design_1_wrapper_propImpl.xdc] to another XDC file and exclude this new file from synthesis with the used_in_synthesis property (File Properties dialog in GUI) and re-run elaboration/synthesis.
Parsing XDC File [/u/halle/dwe/home_at/Desktop/Test/Test.gen/sources_1/bd/design_1/ip/design_1_rst_ps7_0_50M_0_1/design_1_rst_ps7_0_50M_0_board.xdc] for cell 'design_1_i/rst_ps7_0_50M/U0'
Finished Parsing XDC File [/u/halle/dwe/home_at/Desktop/Test/Test.gen/sources_1/bd/design_1/ip/design_1_rst_ps7_0_50M_0_1/design_1_rst_ps7_0_50M_0_board.xdc] for cell 'design_1_i/rst_ps7_0_50M/U0'
Parsing XDC File [/u/halle/dwe/home_at/Desktop/Test/Test.gen/sources_1/bd/design_1/ip/design_1_rst_ps7_0_50M_0_1/design_1_rst_ps7_0_50M_0.xdc] for cell 'design_1_i/rst_ps7_0_50M/U0'
Finished Parsing XDC File [/u/halle/dwe/home_at/Desktop/Test/Test.gen/sources_1/bd/design_1/ip/design_1_rst_ps7_0_50M_0_1/design_1_rst_ps7_0_50M_0.xdc] for cell 'design_1_i/rst_ps7_0_50M/U0'
Parsing XDC File [/u/halle/dwe/home_at/Desktop/Test/Test.gen/sources_1/bd/design_1/ip/design_1_axi_smc_2/bd_0/ip/ip_1/bd_6e42_psr_aclk_0_board.xdc] for cell 'design_1_i/axi_smc/inst/clk_map/psr_aclk/U0'
Finished Parsing XDC File [/u/halle/dwe/home_at/Desktop/Test/Test.gen/sources_1/bd/design_1/ip/design_1_axi_smc_2/bd_0/ip/ip_1/bd_6e42_psr_aclk_0_board.xdc] for cell 'design_1_i/axi_smc/inst/clk_map/psr_aclk/U0'
Parsing XDC File [/u/halle/dwe/home_at/Desktop/Test/Test.gen/sources_1/bd/design_1/ip/design_1_axi_smc_2/bd_0/ip/ip_1/bd_6e42_psr_aclk_0.xdc] for cell 'design_1_i/axi_smc/inst/clk_map/psr_aclk/U0'
Finished Parsing XDC File [/u/halle/dwe/home_at/Desktop/Test/Test.gen/sources_1/bd/design_1/ip/design_1_axi_smc_2/bd_0/ip/ip_1/bd_6e42_psr_aclk_0.xdc] for cell 'design_1_i/axi_smc/inst/clk_map/psr_aclk/U0'
Parsing XDC File [/u/halle/dwe/home_at/Desktop/Test/Test.gen/sources_1/bd/design_1/ip/design_1_axi_gpio_0_1_1/design_1_axi_gpio_0_1_board.xdc] for cell 'design_1_i/axi_gpio_0/U0'
Finished Parsing XDC File [/u/halle/dwe/home_at/Desktop/Test/Test.gen/sources_1/bd/design_1/ip/design_1_axi_gpio_0_1_1/design_1_axi_gpio_0_1_board.xdc] for cell 'design_1_i/axi_gpio_0/U0'
Parsing XDC File [/u/halle/dwe/home_at/Desktop/Test/Test.gen/sources_1/bd/design_1/ip/design_1_axi_gpio_0_1_1/design_1_axi_gpio_0_1.xdc] for cell 'design_1_i/axi_gpio_0/U0'
Finished Parsing XDC File [/u/halle/dwe/home_at/Desktop/Test/Test.gen/sources_1/bd/design_1/ip/design_1_axi_gpio_0_1_1/design_1_axi_gpio_0_1.xdc] for cell 'design_1_i/axi_gpio_0/U0'
INFO: [Project 1-236] Implementation specific constraints were found while reading constraint file [/var/tmp/dwe_vivado_inst/Vivado/2021.2/data/ip/xpm/xpm_memory/tcl/xpm_memory_xdc.tcl]. These constraints will be ignored for synthesis but will be used in implementation. Impacted constraints are listed in the file [.Xil/design_1_wrapper_propImpl.xdc].
Resolution: To avoid this warning, move constraints listed in [.Xil/design_1_wrapper_propImpl.xdc] to another XDC file and exclude this new file from synthesis with the used_in_synthesis property (File Properties dialog in GUI) and re-run elaboration/synthesis.
INFO: [Project 1-1714] 112 XPM XDC files have been applied to the design.
Completed Processing XDC Constraints

Netlist sorting complete. Time (s): cpu = 00:00:00 ; elapsed = 00:00:00 . Memory (MB): peak = 8326.113 ; gain = 0.000 ; free physical = 379567 ; free virtual = 789333
INFO: [Project 1-111] Unisim Transformation Summary:
  A total of 233 instances were transformed.
  RAM16X1D => RAM32X1D (RAMD32(x2)): 6 instances
  RAM32M => RAM32M (RAMD32(x6), RAMS32(x2)): 211 instances
  RAM32X1D => RAM32X1D (RAMD32(x2)): 16 instances

RTL Elaboration Complete:  : Time (s): cpu = 00:00:20 ; elapsed = 00:00:11 . Memory (MB): peak = 9589.516 ; gain = 1371.055 ; free physical = 379634 ; free virtual = 789400
40 Infos, 17 Warnings, 0 Critical Warnings and 0 Errors encountered.
synth_design completed successfully
synth_design: Time (s): cpu = 00:00:22 ; elapsed = 00:00:14 . Memory (MB): peak = 9589.516 ; gain = 1371.055 ; free physical = 379622 ; free virtual = 789388
reset_run synth_1
INFO: [Project 1-1161] Replacing file /u/halle/dwe/home_at/Test/Test.srcs/utils_1/imports/synth_1/rv_pl.dcp with file /u/halle/dwe/home_at/Desktop/Test/Test.runs/synth_1/design_1_wrapper.dcp
launch_runs synth_1 -jobs 64
[Fri Feb 20 16:26:41 2026] Launched synth_1...
Run output will be captured here: /u/halle/dwe/home_at/Desktop/Test/Test.runs/synth_1/runme.log
close_design
open_run synth_1 -name synth_1
Design is defaulting to impl run constrset: constrs_1
Design is defaulting to synth run part: xc7z020clg400-1
INFO: [Project 1-454] Reading design checkpoint '/u/halle/dwe/home_at/Desktop/Test/Test.gen/sources_1/bd/design_1/ip/design_1_axi_bram_ctrl_0_0/design_1_axi_bram_ctrl_0_0.dcp' for cell 'design_1_i/axi_bram_ctrl_0'
INFO: [Project 1-454] Reading design checkpoint '/u/halle/dwe/home_at/Desktop/Test/Test.gen/sources_1/bd/design_1/ip/design_1_axi_bram_ctrl_1_0/design_1_axi_bram_ctrl_1_0.dcp' for cell 'design_1_i/axi_bram_ctrl_1'
INFO: [Project 1-454] Reading design checkpoint '/u/halle/dwe/home_at/Desktop/Test/Test.gen/sources_1/bd/design_1/ip/design_1_axi_bram_ctrl_1_bram_0/design_1_axi_bram_ctrl_1_bram_0.dcp' for cell 'design_1_i/axi_bram_ctrl_1_bram'
INFO: [Project 1-454] Reading design checkpoint '/u/halle/dwe/home_at/Desktop/Test/Test.gen/sources_1/bd/design_1/ip/design_1_axi_gpio_0_1_1/design_1_axi_gpio_0_1.dcp' for cell 'design_1_i/axi_gpio_0'
INFO: [Project 1-454] Reading design checkpoint '/u/halle/dwe/home_at/Desktop/Test/Test.gen/sources_1/bd/design_1/ip/design_1_axi_smc_2/design_1_axi_smc_2.dcp' for cell 'design_1_i/axi_smc'
INFO: [Project 1-454] Reading design checkpoint '/u/halle/dwe/home_at/Desktop/Test/Test.gen/sources_1/bd/design_1/ip/design_1_blk_mem_gen_0_0_1/design_1_blk_mem_gen_0_0.dcp' for cell 'design_1_i/blk_mem_gen_0'
INFO: [Project 1-454] Reading design checkpoint '/u/halle/dwe/home_at/Desktop/Test/Test.gen/sources_1/bd/design_1/ip/design_1_processing_system7_0_0_1/design_1_processing_system7_0_0.dcp' for cell 'design_1_i/processing_system7_0'
INFO: [Project 1-454] Reading design checkpoint '/u/halle/dwe/home_at/Desktop/Test/Test.gen/sources_1/bd/design_1/ip/design_1_rst_ps7_0_50M_0_1/design_1_rst_ps7_0_50M_0.dcp' for cell 'design_1_i/rst_ps7_0_50M'
INFO: [Project 1-454] Reading design checkpoint '/u/halle/dwe/home_at/Desktop/Test/Test.gen/sources_1/bd/design_1/ip/design_1_rv_pl_0_1_1/design_1_rv_pl_0_1.dcp' for cell 'design_1_i/rv_pl_0'
Netlist sorting complete. Time (s): cpu = 00:00:00.41 ; elapsed = 00:00:00.40 . Memory (MB): peak = 9589.516 ; gain = 0.000 ; free physical = 379916 ; free virtual = 789632
INFO: [Netlist 29-17] Analyzing 437 Unisim elements for replacement
INFO: [Netlist 29-28] Unisim Transformation completed in 0 CPU seconds
INFO: [Project 1-479] Netlist was created with Vivado 2021.2
INFO: [Project 1-570] Preparing netlist for logic optimization
Parsing XDC File [/u/halle/dwe/home_at/Desktop/Test/Test.gen/sources_1/bd/design_1/ip/design_1_processing_system7_0_0_1/design_1_processing_system7_0_0.xdc] for cell 'design_1_i/processing_system7_0/inst'
Finished Parsing XDC File [/u/halle/dwe/home_at/Desktop/Test/Test.gen/sources_1/bd/design_1/ip/design_1_processing_system7_0_0_1/design_1_processing_system7_0_0.xdc] for cell 'design_1_i/processing_system7_0/inst'
Parsing XDC File [/u/halle/dwe/home_at/Desktop/Test/Test.gen/sources_1/bd/design_1/ip/design_1_rst_ps7_0_50M_0_1/design_1_rst_ps7_0_50M_0_board.xdc] for cell 'design_1_i/rst_ps7_0_50M/U0'
Finished Parsing XDC File [/u/halle/dwe/home_at/Desktop/Test/Test.gen/sources_1/bd/design_1/ip/design_1_rst_ps7_0_50M_0_1/design_1_rst_ps7_0_50M_0_board.xdc] for cell 'design_1_i/rst_ps7_0_50M/U0'
Parsing XDC File [/u/halle/dwe/home_at/Desktop/Test/Test.gen/sources_1/bd/design_1/ip/design_1_rst_ps7_0_50M_0_1/design_1_rst_ps7_0_50M_0.xdc] for cell 'design_1_i/rst_ps7_0_50M/U0'
Finished Parsing XDC File [/u/halle/dwe/home_at/Desktop/Test/Test.gen/sources_1/bd/design_1/ip/design_1_rst_ps7_0_50M_0_1/design_1_rst_ps7_0_50M_0.xdc] for cell 'design_1_i/rst_ps7_0_50M/U0'
Parsing XDC File [/u/halle/dwe/home_at/Desktop/Test/Test.gen/sources_1/bd/design_1/ip/design_1_axi_smc_2/bd_0/ip/ip_1/bd_6e42_psr_aclk_0_board.xdc] for cell 'design_1_i/axi_smc/inst/clk_map/psr_aclk/U0'
Finished Parsing XDC File [/u/halle/dwe/home_at/Desktop/Test/Test.gen/sources_1/bd/design_1/ip/design_1_axi_smc_2/bd_0/ip/ip_1/bd_6e42_psr_aclk_0_board.xdc] for cell 'design_1_i/axi_smc/inst/clk_map/psr_aclk/U0'
Parsing XDC File [/u/halle/dwe/home_at/Desktop/Test/Test.gen/sources_1/bd/design_1/ip/design_1_axi_smc_2/bd_0/ip/ip_1/bd_6e42_psr_aclk_0.xdc] for cell 'design_1_i/axi_smc/inst/clk_map/psr_aclk/U0'
Finished Parsing XDC File [/u/halle/dwe/home_at/Desktop/Test/Test.gen/sources_1/bd/design_1/ip/design_1_axi_smc_2/bd_0/ip/ip_1/bd_6e42_psr_aclk_0.xdc] for cell 'design_1_i/axi_smc/inst/clk_map/psr_aclk/U0'
Parsing XDC File [/u/halle/dwe/home_at/Desktop/Test/Test.gen/sources_1/bd/design_1/ip/design_1_axi_gpio_0_1_1/design_1_axi_gpio_0_1_board.xdc] for cell 'design_1_i/axi_gpio_0/U0'
Finished Parsing XDC File [/u/halle/dwe/home_at/Desktop/Test/Test.gen/sources_1/bd/design_1/ip/design_1_axi_gpio_0_1_1/design_1_axi_gpio_0_1_board.xdc] for cell 'design_1_i/axi_gpio_0/U0'
Parsing XDC File [/u/halle/dwe/home_at/Desktop/Test/Test.gen/sources_1/bd/design_1/ip/design_1_axi_gpio_0_1_1/design_1_axi_gpio_0_1.xdc] for cell 'design_1_i/axi_gpio_0/U0'
Finished Parsing XDC File [/u/halle/dwe/home_at/Desktop/Test/Test.gen/sources_1/bd/design_1/ip/design_1_axi_gpio_0_1_1/design_1_axi_gpio_0_1.xdc] for cell 'design_1_i/axi_gpio_0/U0'
INFO: [Project 1-1714] 112 XPM XDC files have been applied to the design.
INFO: [Opt 31-138] Pushed 0 inverter(s) to 0 load pin(s).
Generating merged BMM file for the design top 'design_1_wrapper'...
Netlist sorting complete. Time (s): cpu = 00:00:00.01 ; elapsed = 00:00:00 . Memory (MB): peak = 9589.516 ; gain = 0.000 ; free physical = 379972 ; free virtual = 789689
INFO: [Project 1-111] Unisim Transformation Summary:
  A total of 233 instances were transformed.
  RAM16X1D => RAM32X1D (RAMD32(x2)): 6 instances
  RAM32M => RAM32M (RAMD32(x6), RAMS32(x2)): 211 instances
  RAM32X1D => RAM32X1D (RAMD32(x2)): 16 instances

open_run: Time (s): cpu = 00:00:12 ; elapsed = 00:00:07 . Memory (MB): peak = 9589.516 ; gain = 0.000 ; free physical = 379744 ; free virtual = 789451
report_utilization -name utilization_1
report_timing_summary -delay_type min_max -report_unconstrained -check_timing_verbose -max_paths 10 -input_pins -routable_nets -name timing_1
INFO: [Timing 38-35] Done setting XDC timing constraints.
INFO: [Timing 38-91] UpdateTimingParams: Speed grade: -1, Delay Type: min_max.
INFO: [Timing 38-191] Multithreading enabled for timing update using a maximum of 8 CPUs
add_files -fileset constrs_1 -norecurse /u/halle/dwe/home_at/Desktop/HDL_WS2526/template_PYNQ-Z2_ref.xdc
import_files -fileset constrs_1 /u/halle/dwe/home_at/Desktop/HDL_WS2526/template_PYNQ-Z2_ref.xdc
close_design
open_bd_design {/u/halle/dwe/home_at/Desktop/Test/Test.srcs/sources_1/bd/design_1/design_1.bd}
Reading block design file </u/halle/dwe/home_at/Desktop/Test/Test.srcs/sources_1/bd/design_1/design_1.bd>...
Adding component instance block -- xilinx.com:ip:processing_system7:5.5 - processing_system7_0
Adding component instance block -- xilinx.com:ip:axi_bram_ctrl:4.1 - axi_bram_ctrl_0
Adding component instance block -- xilinx.com:ip:axi_bram_ctrl:4.1 - axi_bram_ctrl_1
Adding component instance block -- xilinx.com:ip:blk_mem_gen:8.4 - blk_mem_gen_0
Adding component instance block -- xilinx.com:ip:proc_sys_reset:5.0 - rst_ps7_0_50M
Adding component instance block -- xilinx.com:ip:blk_mem_gen:8.4 - axi_bram_ctrl_1_bram
Adding component instance block -- xilinx.com:ip:smartconnect:1.0 - axi_smc
Adding component instance block -- user.org:user:rv_pl:1.0 - rv_pl_0
Adding component instance block -- xilinx.com:ip:axi_gpio:2.0 - axi_gpio_0
Successfully read diagram <design_1> from block design file </u/halle/dwe/home_at/Desktop/Test/Test.srcs/sources_1/bd/design_1/design_1.bd>
regenerate_bd_layout
validate_bd_design -force
INFO: [xilinx.com:ip:smartconnect:1.0-1] design_1_axi_smc_2: SmartConnect design_1_axi_smc_2 is in High-performance Mode.
validate_bd_design: Time (s): cpu = 00:00:05 ; elapsed = 00:00:05 . Memory (MB): peak = 10423.199 ; gain = 0.000 ; free physical = 379521 ; free virtual = 789256
delete_bd_objs [get_bd_addr_segs rv_pl_0/m_inst_axi/SEG_axi_bram_ctrl_1_Mem0]
delete_bd_objs [get_bd_addr_segs rv_pl_0/m_data_axi/SEG_axi_bram_ctrl_0_Mem0]
